title,review_score,review_summary,review_text,description,authors,publisher,categories
Poland,5.0,Massively entertaining,"I haven't read much historical fiction up to now, but 'Poland' is definitely the best so far. It's a large work with each chapter typically covering several years at selected points in Polish history between the 13th and 20th centuries. Michener's ability to render convincing scenes (and to a somewhat lesser extent, characters) is astonishing. It's this kind of novel that makes many an aspiring author wave the white flag and give up any pretensions he/she has of being a master storyteller. Nothing wrong with being second class, but you know a master when you read this.Some previous reviews complain about historical inaccuracies in the novel and then pan it with a low rating. Well that is silly because Michener never claimed that 'Poland' is non-fictional. Though the novel is set against a backdrop of actual events in Poland's history and though we encounter many real historical figures (with some or many perhaps portrayed inaccurately), most of the plot and characters are *fictional*. Michener makes this clear right up front in the Explanation section preceding the first chapter. The three families (Lubonski, Bukowski, Buk) that supply the major players throughout the novel are entirely fictional; hence, so are all of their actions. Some of these actions are portrayed in the novel as having pivotal impacts on major historical events (e.g. Wiktor Bukowski's heroic charge in the Battle of Zamosc, 1920). Though these actions and consequences are not historically accurate, Michener never claimed they would be and hence his right to artistic license should be respected.The chapter on the Nazi occupation is particularly well-rendered and chilling. The descriptions of daily life in the Majdanek concentration camp, to my knowledge, do generally stack up with eyewitness accounts from survivors. It's incomprehensible to me that such monstrosities could have been performed on such a scale, so recently.Like most such novels, 'Poland' focuses on major players and key events of political significance (e.g. wars, power struggles, etc). In doing so, I think we miss a bit of how the common people dealt with these events. By common people I mean the peasants, merchants, civilians, nobility et al who did not actually take part in the events (unlike the Lubonskis, Bukowskis, and Buks). In the end, however, 'Poland' is massively entertaining.","The United States and Poland adds a new dimension to the scholarship of America's international relations. Piotr Wandycz presents a comprehensive picture of the changing relationships between the United States and Poland over two hundred years. This work is, as Wandycz writes, both a survey and a synthesis. Because he believes that an understanding of the history of Poland is necessary in order to appreciate the complex nature of its involvement with the United States, he provides a thorough analysis of Poland's internal development, concentrating on the twentieth century. He also carefully places American-Polish history in the broader context of changing East-West relations. Finally, he speculates on the future between the two countries as detente unfolds and surprising happenings like the election of a Polish Pope occur. Ultimately, Wandycz acknowledges, the American-Polish relationship has been one-sided, even more so than is normal in contacts between great and small powers. ""One must not imagine,"" he writes, ""that Poland has been on the minds of American foreign policy makers consistently...but if one thinks of Poland in the context of East Central Europe, her significance increases dramatically."" This book provides a necessary history and evaluation of a nation state once dominant in Europe and now searching for an appropriate role.",['Piotr Stefan Wandycz'],Harvard University Press,['History']
The Man from Stone Creek,4.0,The Man From Stone Creek,"As usual, I enjoyed another book from Linda Lael Miller and found several mistakes. They need to hire me to read for them and make the corrections.","Arizona Ranger Sam O'Ballivan, posing as a schoolmaster to control the rough ranchers' children who attend the school, finds himself distracted by Maddie, the lovely sister of one of his worst students, who runs the local mercantile.",['Linda Lael Miller'],HQN Books,['Fiction']
The Hobbit,5.0,"A fantastic read, even for non-fantasy fans!","I read this book, having heard so much good being said about the Lord of the Rings, despite having dismissed the fantasy genre as kiddy reading. Besides the book is much thinner than the daunting thick volume of the latter! The book has all the ingredients of a sure winner, regardless of genres - humor, action and emotion. I loved it so much that I am actually now keen on reading the Lord of the Rings, thick volume and all. Count me in as a fantasy fan - this books has won me over!","Celebrating 75 years of one of the world's most treasured classics with an all new trade paperback edition. Repackaged with new cover art. 500,000 first printing.",['J. R. R. Tolkien'],Mariner Books,['Juvenile Fiction']
The Courage to Be,5.0,Tillich makes the world look shimmeringly alive.,"&quot;It takes tremendous courage to resist the lure of appearances. The power of being which is manifest in such courage is so great that the gods tremble in fear of it.&quot; Paul Tillich, The Courage to Be.Paul Tillich's ideas are a response to existentialism, German philosphy, modern physics &amp; the success of totalitarian movements in Germany, Russia &amp; Italy. He is a bridge between the 19th Century &amp; the growth of new theological thought in latter part of the Twentieth.Tillich is not all that difficult to understand in The Courage to Be. However, it's unfortunate that his three wonderful collections of sermons (The Shaking of the Foundations; The New Being; The Eternal Now) are out-of-print, as these are his best introductions.Readers coming to Tillich will have to grapple with the common metaphors of Christian faith. For Tillich, the concepts of Heaven &amp; even an afterlife are not terribly important, as they imply a continuation of life in time that he is not able to accept scientifically or on faith. So one meets those lovely semi-metaphors of &quot;being itself,&quot; &quot;non-being&quot; &amp; &quot;ground of being&quot; that, for me at least, were a more clear explanation of how I experience the world than God the &quot;Father&quot; or Holy Ghost.This makes Tillich a crucial step into Feminist &amp; Language theology, although he couldn't quite make the big leap himself.Basically, Tillich says we're stuck in an undefinable present that moves creatively into an unknown future in which nothing is a given but the fact that we are alive right now, so what do we intend to do about it? This is &quot;being&quot; &amp; being, above all else, requires courage; the courage of early Christians facing the axe or the fire. As for Tillich's &quot;Ground of Being,&quot; one might compare it - inadequately - to a tree as a reflection of its roots - a metaphor I copped from another Paul ...artist Paul Klee. Tillich says that we cannot speak unsymbolically about being.In the aftermath of September 11, 2001, Paul Tillich's theology gains even greater relevance. He witnessed in Germany the acquiescence of the established churches to National Socialism &amp; the failure of Democratic Christian Socialism. I do not believe he would have many kind words for contemporary Islam, a religious system so bound to orthodoxy as to make it incapable of relevant reform. On the other hand, Tillich would have immediately recognized those manifestations of the &quot;Kingdom of God&quot; which began appearing even before the Twin Towers had collapsed. Our estrangement from God in the Eternal Now (which invites demonic energy as a tall tree invites lightning) is overcome only in the present moment. Evil may be defeated with violent retaliation, but it is conquered with love.Paul Tillich is especially liberating for artists. Stopping just short of Buddhism, Tillich makes the world look shimmeringly alive &amp; filled with possibilities, yet so transient - a world of appearances.&quot;The courage to be is rooted in the God who appears when God has disappeared in the anxiety of doubt.&quot; Paul Tillich, The Courage to BeBob RixonAlso recommended&quot; Henri Bergson, An Introduction to Metaphysics","“Marie Kondo, but for your brain.” —HelloGiggles “Compelling from front to back. Highly recommend.” —Marc Andreessen Reading this book could change your life. The Courage to Be Disliked, already an enormous bestseller in Asia with more than 3.5 million copies sold, demonstrates how to unlock the power within yourself to be the person you truly want to be. Is happiness something you choose for yourself? The Courage to Be Disliked presents a simple and straightforward answer. Using the theories of Alfred Adler, one of the three giants of nineteenth-century psychology alongside Freud and Jung, this book follows an illuminating dialogue between a philosopher and a young man. Over the course of five conversations, the philosopher helps his student to understand how each of us is able to determine the direction of our own life, free from the shackles of past traumas and the expectations of others. Rich in wisdom, The Courage to Be Disliked will guide you through the concepts of self-forgiveness, self-care, and mind decluttering. It is a deeply liberating way of thinking, allowing you to develop the courage to change and ignore the limitations that you might be placing on yourself. This plainspoken and profoundly moving book unlocks the power within you to find lasting happiness and be the person you truly want to be. Millions have already benefited from its teachings, now you can too.","['Ichiro Kishimi', 'Fumitake Koga']",Simon and Schuster,['Self-Help']
TAI-PAN,1.0,Tai Pan is no Shogun,"Like many on this board, I picked up Tai Pan after reading Shogun. In my opinion Shogun is one of the top 5 novels written in the English language. Perhaps because of the expectation set by Shogun, I found Tai Pan to be a huge disappointment. Shogun was a story of empire-building and forbidden romance. Half way through Tai Pan, the ""drama"" centers around a pending beauty pageant and which two tea-carrying ships will dock first on a different continent six months in the future. I started, but was unable to finish, both Tai Pan and Noble House. For me at least, being a fan of Clavell turned out to be really just a fan of Shogun.","'Intensely readable and exciting' Sunday Telegraph Set in the turbulent days of the founding of Hong Kong in the 1840s, Tai-Pan is the story of Dirk Struan, the ruler - the Tai-Pan - of the most powerful trading company in the Far East. He is also a pirate, an opium smuggler, and a master manipulator of men. This is the story of his fight to establish himself and his dynasty as the undisputed masters of the Orient. 'Packed with action . . . gaudy and flamboyant with blood and sin, treachery and conspiracy, sex and murder . . . grand entertainment' New York Times",['James Clavell'],Hachette UK,['Fiction']
East,5.0,The heroine saves the hero.,The heroine saves the hero.Enjoyed this lovely book. Rose is a strong and adventurous young woman.,"Rose was born into the world facing north, and as a north child, superstition says that she will be a wanderer, travelling far from home. This prophecy is fulfilled when she is taken on the back of a white bear to a mysterious empty castle, where a silent stranger appears to her night after night. When her curiosity overcomes her, she loses her heart, and must journey to a land east of the sun and west of the moon to reclaim it. ""An enchanting retelling of a traditional fairytale, this beautifully written story completely swept me away"" - Becky Stradwick, Borders UK Shortlisted - Ottakar's Children's Book Prize 2006",['Edith Pattou'],Usborne Publishing Ltd,['Juvenile Fiction']
A Deepness in the Sky,5.0,Great science fiction,"This is great science fiction! I usually like Vinge's books, and this one was fully up to par. It intertwines two converging stories. One is about a group of (human) freedom loving space traders who travel and sell in many star systems, who are thrown together with (human) totalitarian exploiters. The other is about an intelligent race of spiders whose &quot;on-off&quot; star blinks with a century-long period -- thus they must endure a multi-decade deep freeze during their lifetimes (the &quot;Deepness&quot; in the title is a place where spiders can hibernate through a freeze).This is great science fiction. The plot is exciting, and Vinge invents and explores the ramifications of several interesting technologies plus the weird on-off star environment. He also explores social conflicts between the human societies and the spider societies. Both sets of societies appear to have intentional parallels with current societies here on earth.I believe Vinge intends those parallels to be an important part of the book, so I'm going to write a little more about them. Many of Vinge's books feature societies based around a libertarian ideal of little or no government, and privatization of government's traditional functions. For example, in a story called &quot;The Ungoverned,&quot; a section of the former United States has no government at all, and people hire private companies with names like &quot;Michigan State Police&quot; and &quot;Al's protection Racket&quot; for traditional government services.One problem with a government-free society is the possibility that some people may completely trample the rights of others without fear of reprisal. In &quot;Deepness,&quot; Vinge encapsulates that problem as the problem slavery. The totalitarians are not averse to slavery; the freedom-loving traders despise slavery.I see one flaw in the book, which doesn't affect the science fiction or the exciting plot; only the philosophy. The flaw is that Vinge doesn't adequately account for *why* the good guys' hate slavery. After all, one could consider slavery a form of contract, or slaves an article of trade (slavery was treated this way here on earth for thousands of years). Vinge's explanation of why the traders hate slavery is essentially social taboo -- it's part of the trader culture. But it's a taboo that has lasted a thousand years and holds everywhere in the many loose-knit trader communities. Why? We know societies change and upstarts challenge taboos, so the ones that remain must serve some very useful purpose. Vinge doesn't account for the constancy of the taboo.I think a libertarian philosophy that allowed slavery would be repugnant to many readers, so Vinge created one that prevented slavery, but his taboo mechanism is weak. I think this points up a flaw in libertarian philosophy that Vinge is struggling to deal with -- the flaw being that libertarianism may be a little to value-neutral to appeal to mainstream American readers raised on apple pie and the U.S. Constitution. I'll be interested to see how Vinge continues to deal with this issue in future writings.Never the less, as I mentioned above, the flaw doesn't affect the plot or the science fiction; only the philosophy of the book. It's still great SF, imaginative and thought provoking, and a very enjoyable read.","A Hugo award-winning Novel! “Vinge is one of the best visionary writers of SF today.” —David Brin Thirty-Thousand years before A Fire Upon the Deep, humans stand on the verge of first contact with an alien race. Two human groups: the Qeng Ho, a culture of free traders, and the Emergents, a ruthless society based on the technological enslavement of minds. The group that opens trade with the aliens will reap unimaginable riches. But first, both groups must wait at the aliens' very doorstep for their strange star to relight and for their planet to reawaken, as it does every two hundred and fifty years. More than just a great science fiction adventure, A Deepness in the Sky is a universal drama of courage, self-discovery, and the redemptive power of love. Tor books by Vernor Vinge Realtime/Bobble Series The Peace War Marooned in Realtime Other Novels The Witling Tatja Grimm's World Rainbows End Collections Collected Stories of Vernor Vinge True Names At the Publisher's request, this title is being sold without Digital Rights Management Software (DRM) applied.",['Vernor Vinge'],Macmillan,['Fiction']
Herbs for Hepatitis C and the Liver (A Storey Medicinal Herb Guide),5.0,A MUST have,"If you have Hep C as do I, this is a MUST have book. Very well written in a way that makes it seem it was written just for you. PACKED with vital info. I only wish I would have gotten this book sooner.","Providing practical guidance and hope, Stephen Harrod Buhner offers a thorough examination of the most effective herbal remedies for hepatitis C. While promoting a protocol of cleansing the liver and strengthening the immune system through a combination of diet, herbal medicines, and lifestyle changes, this guide will help you choose the best remedies for your individual needs. Clear descriptions of how common herbal treatments work to combat hepatitis C will empower you to make informed choices that can successfully mitigate your suffering.",['Stephen Harrod Buhner'],"Storey Publishing, LLC",['Health & Fitness']
Mountains of Spices,5.0,Mountain of Spices,"I love this book. I have trouble with memorazation. This book keeps my interest. It s very easy to read. I like that.It is an allegory in christian form. There is a girl named named ""Grace and Glory"". She was formerly ""Much Afraid"" in the book ""Hinds feet on high places"" which I would recommend also. Anyway in the book ""Mountain of Spices"" she helps her relatives- to follw the good shepherd-Jesus and get to the ""high place""I am not positive what that is. It could be heaven- or to be saved.it s very enjoyable reading. it is fun reading. Not boring or authoritative. Think of a book like ""Nancy Drew by carolyn Keen- It is fun, easy reading like that.The author of ""Mountain of spices is Hannah Hurnard.Ths was a paperback. It did not cost much.",An allegory about human weakness and strengths comparing the spices in song of Solomon to the fruits of the Spirit.,['Hannah Hurnard'],"Tyndale House Publishers, Inc.",['Fiction']
"The Subtle Knife: His Dark Materials, Book 2",5.0,Beautiful!,"Like many folks, I find that the second installment in a trilogy is often the weakest. The author usually runs out of steam, or doesn't care about his/her characters enough to put them into as interesting a set of situations as they were in with volume #1. Perhaps, the author feels that he/she can take a breather and bring everything up to speed with #3.Not so with Pullman. He delivers a wallop with the first page and doesn't let up. Pullman also ends the book with a set of cliffhangers that must have made readers absolutely nuts until &quot;The Amber Spyglass&quot; arrived.The tenderness is still there (I nearly cried over the parts about Will's mother). The evil Mrs. Coulter is again on the scene, totally amoral and vicious, but not so &quot;perfectly evil&quot; that she seems unreal. Lyra is as tough and smart as always, while still making mistakes and paying for them. Pullman is also brave enough to kill off a few of his favorites, which keeps up the plausibilty level and propels the survivors forward.And the concept of a righteous war in Heaven...! The author shows a tremendous amount of courage even to bring up the subject, let alone tackle it to the degree he does. Readers may disagree with him; but they will be forced to think about his ideas.Very, very good.","Will is 12 years old, and he's just killed a man. Now he's on his own, on the run, determined to discover the truth about his father's disappearance.",['Philip Pullman'],,['Adventure stories']
The Big Book of Brewing,5.0,Should be part of any brewing library!,"I read a rewiew on David Line's book, ""Brewing Beers Like Those You Buy"". I felt the rewiew was so wrong that I wrote the following:Dave Line wrote two great books, ""The Big Book of Brewing"" and this book. This book was a recipe book, not a guide. It's great to see how he approached brewing each beer. I have been brewing full mash brewing since 1980. I usually brew bitter and pale ales. This book is a constant reference.Other than the discontinued use of Sodium metabisulphite for sterilization, I'm not sure how ""Homebrewing has evolved so much since then""?His Big Book of Brewing was written in 1974 and the recipe book in 1978. The making great beer has not changed since then. The full mash process has been the same for hundreds of years.Both books are great reference books and should be part of any brewing library.","This is a book for any really enthusiastic and ambitious home brewer - the person who wants to brew high quality, 'true' beers using real hops and grains, rather than by using more easily-handled kits and powdered or liquid malt extracts.",['Dave Line'],,['Brewing']
Point of Origin,1.0,What is next for Kay?,I keep waiting for Kay to decide the lifestyle Lucy leads is the one for her....and it seems the plot is heading that way. This was her worst book and I am not glad to say I read it...just that it is my last to read.,CORNWELL/POINT OF ORIGIN,['Patricia Daniels Cornwell'],Berkley,['Fiction']
"Incubus Dreams (Anita Blake, Vampire Hunter, Book 12)",5.0,What's the fuss folks?,"I've read many of these reviews and almost did not purchase Ms. Hamilton's next book in the Anita Blake series (Incubus Dreams) because of them. I am glad I purchased it despite the mixed reviews. I don't understand why so many people are whining about the sex. I found the scenes to be surprising and entertaining. Yes, there were more graphic sex scenes than in previous stories - but, hey - I thought it was a logical direction for the story to go. Anita has been evolving into the person that she ultimately becomes in this novel. I do not think that I could have taken any more of her tip-toeing around serious issues in her relationships (yes, relationships - as in more than one) or anymore of her self-loathing because of her sexual desires. People, just realize a few things: One, this is a book - it is entertainment; Two - vampires, werewolves, necromancers, etc. are not real (see point number one); Three - if you are this far into the series and are surprised and shocked by this turn of events you probably should not read vampire books.","In her role as consort of Jean-Claude, the seductive Master Vampire of the City, Anita Blake is faced with a dangerous conflict of interest when she assists with the search for a vampire serial killer who is stalking strippers.",['Laurell K. Hamilton'],"Anita Blake, Vampire Hunter",['Fiction']
Psycho-Cybernetics,5.0,The First Book of It's Kind I Read,"This is the first book of it's kind I ever read and it is still a truly inspiring and very informative work today.Best wishes,Donald Ryles PhD, CHAuthor of Hidden Secrets of ""Many, But One","Cybernetics (loosely translated from the Greek): “a helmsman who steers his ship to port.” Psycho-Cybernetics is a term coined by Dr. Maxwell Maltz, which means, “steering your mind to a productive, useful goal so you can reach the greatest port in the world, peace of mind.” Since its first publication in 1960, Maltz’s landmark bestseller has inspired and enhanced the lives of more than 30 million readers. In this updated edition, with a new introduction and editorial commentary by Matt Furey, president of the Psycho-Cybernetics Foundation, the original text has been annotated and amplified to make Maltz’s message even more relevant for the contemporary reader. “Before the mind can work efficiently, we must develop our perception of the outcomes we expect to reach. Maxwell Maltz calls this Psycho-Cybernetics; when the mind has a defined target it can focus and direct and refocus and redirect until it reaches its intended goal.” —Tony Robbins (from Unlimited Power) Maltz was the first researcher and author to explain how the self-image (a term he popularized) has complete control over an individual’s ability to achieve (or fail to achieve) any goal. And he developed techniques for improving and managing self-image—visualization, mental rehearsal, relaxation—which have informed and inspired countless motivational gurus, sports psychologists, and self-help practitioners for more than fifty years. The teachings of Psycho-Cybernetics are timeless because they are based on solid science and provide a prescription for thinking and acting that lead to quantifiable results.",['Maxwell Maltz'],Penguin,['Self-Help']
"The river war, an account of the reconquest of the Sudan,",5.0,the river war,"The River War is an outstanding account of Anglo Egyptian relations at the end of the Nineteenth Century as well as a detailed chronical of Herbert Kitchener.s three year campaign to reassert Egyptian, and thus British control over the Nile basin. Young Churchill shows the beginnings of the great writer he became, and we see the beginnnings as well of his development from a pure Victorian to a man of the world. The book offers insights, still timely, into the Arab mind, the crucial role of logistics in military ventures, and the historical divide between Muslim arabs and black Africans. This clash of class and culture plays out today in Dafur, Alas, the Kindle version lacks maps. endnote: railroad buffs will enjoy immensely the chapter on the railroad built by Kitchener's army.",Retelling in military detail of the operations directed by Lord Kitchener of Khartoum on the Upper Nile from April 1896 to November 1899.,['Winston Churchill'],"Skyhorse Publishing, Inc.",['History']
