title,review_score,review_summary,review_text,description,authors,publisher,categories
"Women, Race & Class",5.0,Prof. Davis clarifies the history of all three struggles.,"Professor Davis provides a history of the Black, Women's and workers' movements in the US and documents the many points of common contact. She painstakingly supplies an abundance of historical evidence that demonstrates the fact that women, working people or people of color can only succeed in the attainment of their own liberation by working in conjuction with the efforts of the others. She also reminds us that the majority of women are workers and that the majority of people of color are workers, and points out that the outcome of the struggle these groups face will impact directly upon the future condition of all working people","From one of our most important scholars and civil rights activist icon, a powerful study of the women’s liberation movement and the tangled knot of oppression facing Black women. “Angela Davis is herself a woman of undeniable courage. She should be heard.”—The New York Times Angela Davis provides a powerful history of the social and political influence of whiteness and elitism in feminism, from abolitionist days to the present, and demonstrates how the racist and classist biases of its leaders inevitably hampered any collective ambitions. While Black women were aided by some activists like Sarah and Angelina Grimke and the suffrage cause found unwavering support in Frederick Douglass, many women played on the fears of white supremacists for political gain rather than take an intersectional approach to liberation. Here, Davis not only contextualizes the legacy and pitfalls of civil and women’s rights activists, but also discusses Communist women, the murder of Emmitt Till, and Margaret Sanger’s racism. Davis shows readers how the inequalities between Black and white women influence the contemporary issues of rape, reproductive freedom, housework and child care in this bold and indispensable work.",['Angela Y. Davis'],Vintage,['Social Science']
How to Overthrow the Government,4.0,Much more modest proposals than the title suggests,"Okay, I like most readers of this book (I'm certain) first picked it up because the title is catchy. The actual substance of the book is much more modest, and largely centers on hammering the need for campaign finance reform. Along the way, Huffington also trashes pollsters, and emphasizes the need for citizen participation in government and in charitable activities. There really is nothing particularly new or ground breaking here, but Huffington does a nice job of gathering together in one place a lot of anecdotal information about her topics. She bashes politicians of both major parties evenly, and is apparently disappointed that the nominees for the fall elections are Bush and Gore rather than McCain and Bradley. Bottom line: A good read, but don't expect to learn anything that rocks your world. One of her fundamental points -- that the American people have come to expect their political leaders to be a pack of thieves -- is all too true.",,,,
Respiratory Care Exam Review: Review for the Entry Level and Advanced Exams (Book with CD-ROM),5.0,Very good review source,"I really enjoyed this book. The shortcuts and material was easy to understand and helped me prepare for the RRT exam. I was able to attend one of Mr. Persing's seminars. He is an awesome instructor. If you ever have the opportunity to go to one, do it. It is well worth the money.","Respiratory Care Exam Review: Review for the Entry Level and Advanced Exams, 3rd Edition, readies students with review materials for both the CRT and RRT exams! The material is presented in an outline format for efficient studying with special boxes included in the chapter to highlight important information that is often included in the exam. The accompanying CD-ROM provides practice exams for both the advanced and entry level exams to familiarize test-takers with the computerized exam format. Clinical simulations for the RRT are also included to give students the opportunity to practice this very difficult portion of the registry exam. New content has been added to the 3rd edition, including the latest updates to the NBRC content matrix implemented in 2009. Be fully prepared with this comprehensive text!",['Gary Persing'],W B Saunders Company,['Medical']
"The Hobbitt, or there and back again; illustrated by the author.",4.0,BACK AGAIN,"Great graphic novel adaption with beautiful illustrations for the younger crowd, or those just wanting a new view of Middle-earth. I got a bunch for the 10 and under crowd in the family.","Bilbo Baggins, a respectable, well-to-do hobbit, lives comfortably in his hobbit-hole until the day the wandering wizard Gandalf chooses him to take part in an adventure from which he may never return.",['J. R. R. Tolkien'],Houghton Mifflin Harcourt,['Fiction']
A Ring of Endless Light,5.0,My Fave L'engle of All Time!!,"This is a great example of the wonderful books of Madeleine L'engle! If you haven't read this book i strongly suggest you do. Through all of Vicky's misfortunes she is blessed. My favorite thing about this book is the relationship she has with Adam. It makes me kinda of jealous yet I feel dazed when I read about it. This book brought tears to my eyes yet it also gave me opportunities to laugh. I have read this 5 times in my life and I don't plan to stop. Every time I time I read it I can't put it down. If you did enjoy this book, read on with Troubling A Star also by L'engle. It is just as great and won't let you put it down for a second.","In book four of the award-winning Austin Family Chronicles young adult series from Madeleine L’Engle, author of A Wrinkle in Time, Vicky Austin experiences the difficulties and joys of growing up. ""This wasn't the first time that I'd come close to death, but it was the first time I'd been involved in this part of it, this strange, terrible saying goodbye to someone you've loved."" These are Vicky Austin's thoughts as she stands near Commander Rodney's grave while her grandfather, who himself is dying of cancer, recites the funeral service. Watching his condition deteriorate over that long summer is almost more than she can bear. Then, in the midst of her struggle, she finds herself the center of attention for three young men. Leo, Commander Rodney's son, turns to her as an old friend seeking comfort but longing for romance. Zachary, whose attempted suicide inadvertently caused Commander Rodney's death, sees her as the one sane and normal person who can give some meaning to his life. And Adam, a serious young student working at the nearby marine-biology station, discovers Vicky, his friend's little sister, incipient telepathic powers that can help him with his experiments in dolphin communications. Vicky finds solace and brief moments of peace in her poetry, but life goes on around her, and the strain intensifies as she confronts matters of love and of death, of dependence and of responsibility, universal concerns that we all must face. The inevitable crisis comes and Vicky must rely on openness, sensitivity, and the love of others to overcome her private grief. Once again, Madeleine L'Engle has written a story that revels in the drama of vividly portrayed characters and events of the spiritual and moral dimensions of common human experiences. A Ring of Endless Light is a 1981 Newbery Honor Book. Books by Madeleine L'Engle A Wrinkle in Time Quintet A Wrinkle in Time A Wind in the Door A Swiftly Tilting Planet Many Waters An Acceptable Time A Wrinkle in Time: The Graphic Novel by Madeleine L'Engle; adapted & illustrated by Hope Larson Intergalactic P.S. 3 by Madeleine L'Engle; illustrated by Hope Larson: A standalone story set in the world of A Wrinkle in Time. The Austin Family Chronicles Meet the Austins (Volume 1) The Moon by Night (Volume 2) The Young Unicorns (Volume 3) A Ring of Endless Light (Volume 4) A Newbery Honor book! Troubling a Star (Volume 5) The Polly O'Keefe books The Arm of the Starfish Dragons in the Waters A House Like a Lotus And Both Were Young Camilla The Joys of Love","[""Madeleine L'Engle""]","Farrar, Straus and Giroux (BYR)",['Juvenile Fiction']
See More Readers: Planets Around the Sun -Level 1,4.0,"Just The Facts, Mamm.","PLANETS AROUND THE SUN works rather well as an introductory book to the planets of the solar system in the Milky Way. The book briefly discusses the nine planets of the Milky Way, the Earth's Moon, and the asteroid belt between Mars and Jupiter. The last page in the book displays a chart that illustrates, among other things, the distance of each planet from the sun; each planet's orbital period; amount of moons; and the amount of rings. There are several basic space facts scattered throughout the thirty pages, e.g. the winds on Neptune blow at over 700 mph. The thing that separates this book from others of it's kind that I have read are it's bright and vivid pictures. The pictures are full of color and contrast and bring to life the uniqueness of our solar system. Overall this is a wonderful book to introduce children to the wonder and miracle of space.","In typical Seymour Simon fashion, this SeeMore Reader employs clear, evocative language and stunning visuals to create a compelling, introductory overview of our solar system for the very youngest of readers. Newly Updated 2012.",['Seymour Simon'],StarWalk Kids Media,['Juvenile Nonfiction']
The Screwtape letters & Screwtape proposes a toast (Time reading program special edition),4.0,"Thought provoking, serves its purpose",This is a very thought provoking book that serves its purpose. The book concerns the demonic world and its attempts to destroy the life of a man by getting him distracted from the things of God. The book is not strictly Biblical in that it takes some imaginary and poetic license to speculate on what happens in the spirit realm. I thought the book was very readable and helps people understand that the daily things we go through in human existence may have much bigger implications. I was edified by this book.,"The Screwtape Letters by C.S. Lewis is a classic masterpiece of religious satire that entertains readers with its sly and ironic portrayal of human life and foibles from the vantage point of Screwtape, a highly placed assistant to ""Our Father Below."" At once wildly comic, deadly serious, and strikingly original, C.S. Lewis's The Screwtape Letters is the most engaging account of temptation—and triumph over it—ever written.",['C. S. Lewis'],Harper Collins,['Religion']
The 7 habits of highly effective people: Wisdom and insights from,5.0,Life changing,"I'm not fond of self-help books, but this one is definitely worth it of reading and applying the teachings in your life.",,['Stephen R. Covey'],,['Character']
Golden Fox,5.0,Golden Fox,Up to the good standards of Wilbur Smith. I thouroughly enjoyed every page I read. A must read for wilbur smith fans.,"When John Stafford, a young man from a wealthy Philadelphia family, graduates from college in the 1860s, he ventures to the lawless Northwest to satisfy his basic urge to put himself to the test in meeting the challenges of a trying environment. Adventure is what he seeks, and adventure is what he gets. Stafford experiences many turbulent twists and turns in his life. He marries, Little Dove, a beautiful Indian woman of Hidatsa descent. He is accepted into her tribe following his ingenious strategy to defeat his wife's wrathful Blackfeet suitor. And Stafford accepts a request by President Abraham Lincoln to form a highly proficient clandestine fighting force to help the Indians defend themselves against the widespread tyranny. His skilled force consists of several relatives and close friends—black as well as white, male and female, along with a number of Native Americans. Their exploits involve confrontations with river pirates, whisky peddlers, a tragic massacre by unauthorized military action an Indian reprisal, and a marauding gang of cutthroats.",['Frank R. Kowalski'],Trafford Publishing,['Fiction']
"The Birds' Christmas Carol,",5.0,Times past,"My sister is so sentimental that she is going to love this story. I got it to give to her when the opportunity arises...read it myself in the meantime. It's geared toward children, but has a message about sharing and doing what we can to help others. The little girl in the story is sweet and thoughtful and a good role model. Cute story, if a bit sad at times.",Holiday stories.,['Kate Douglas Smith Wiggin'],,['Birds']
Live and let die,3.0,"Fleming's action sequences shine, but novel not as timeless as Bond's debut - 3.5 Stars","Live and Let Die, Fleming's second novel featuring James Bond, wastes no time establishing setting or character. Diving immediately into the action, Fleming sets the template for Bond's adventures to come, particularly on the big screen -- globe-trotting, exotic locales, beautiful women, and intense, oft-times over-the-top, action sequences. Here Bond is sent to New York for a joint operation with American CIA operative Felix Leiter, an ally from Bond's Casino Royale days. They are tasked with uncovering the source of the smuggled gold a Mr. Big is funneling through his vast criminal network, funding operations for the likes of SMERSH. But Mr. Big's reach, and the lengths he'll go to in order to maintain control on his criminal operations, are more powerful and extensive than Bond ever imagined. When Big's henchmen strike a lethal blow, Bond's single-minded resolve to exact vengeance places him in unimaginable danger, and his drive for revenge threatens to blind him to the coolly lethal mastermind's greatest weapon -- the most dangerous denizens of the sea itself.First published in 1954, Fleming's second Bond novel unfortunately does not stand the test of time nearly as well as its predecessor. Because here Bond's nemesis is Mr. Big and his vast criminal network, the African-American community is featured prominently throughout the novel -- and as such Fleming heavily showcases racial attitudes and language that, while it may have been more acceptable during the 1950s, is at the very least jarring to modern readers. Mr. Big fares best here -- as an arch-villain, extremely capable and over-the-top in the best Bond tradition, but his compatriots have aged less favorably, tending towards a hodge-podge of cheap stereotypes. If Fleming had managed to curb his propensity for over-the-top dialect and negative African-American stereotyping, this novel's suspense plotline, no matter how wildly outlandish, would be given freer range to shine unencumbered.If one can manage to keep the novel within the context of the time in which it was published, roughly a third of the way through the book Fleming (mostly) trades in his unfortunate stereotyping for some really well-done action sequences and nail-biting tension in keeping with the spirit of Bond's debut. I was particularly impressed with Bond's tense introduction to Mr. Big and subsequent escape, and the novel's climatic moment which finds Bond and Solitaire dragged through coral-rich waters as live shark bait. As in Casino Royale, I was once again struck by Fleming's economy of language, his sharp-edged prose that colors his narrative with tension and keeps the reader engaged.As an American I also found Fleming's rather...acerbic view of the country interesting, to say the least, but this was tempered by the presence of Felix Leiter, my favorite recurring supporting character in the series thus far. I was quite honestly horrified by Felix's fate midway through the novel, but this was somewhat tempered by the resulting exhibition of Bond's loyalty and drive to see one of his few friends avenged. Bond is by no means a consistently well-rounded or progressive character -- first and foremost he is the ""blunt instrument"" of MI6 -- but thus far in the series I've been favorably impressed by the subtle shades of fallibility that colors his character on the page. There's a brilliant, self-reflective passage about halfway through the book where Bond ruminates on the fragility of life -- and it's brief flashes of humanity, of vulnerability, that bring to mind Craig, my favorite screen Bond.While the racial overtones of Mr. Big and his henchmen date this installment in the Bond series rather poorly, if one can read this strictly as a product of its creator and the time (for good or ill) in which he lived, Fleming delivers some rollicking action sequences and unexpected moments of self-reflection that make fascinating additions to one's knowledge of the Bond canon.",,,,
Thaddeus Stevens,4.0,Well Researched,"This book is apparently very well researched -- only 245 pages on the life of Mr. Stevens and 117 pages of Notes and Bibliography. A bit dry -- reads more like a text book but I learned a lot. Knew very little about this man but after seeing Tommy Lee Jones' portrayal in LINCOLN, I had to learn more. Would have loved if the book contained a bit more of Steven's actual speeches and cutting comments. Writing not up to the quality of Doris Kearns Goodwin, author of the must read &#34;A TEAM OF RIVALS.&#34;","A “powerful” (The Wall Street Journal) biography of one of the 19th century’s greatest statesmen, encompassing his decades-long fight against slavery and his postwar struggle to bring racial justice to America. Thaddeus Stevens was among the first to see the Civil War as an opportunity for a second American revolution—a chance to remake the country as a genuine multiracial democracy. As one of the foremost abolitionists in Congress in the years leading up to the war, he was a leader of the young Republican Party’s radical wing, fighting for anti-slavery and anti-racist policies long before party colleagues like Abraham Lincoln endorsed them. These policies—including welcoming black men into the Union’s armies—would prove crucial to the Union war effort. During the Reconstruction era that followed, Stevens demanded equal civil and political rights for Black Americans—rights eventually embodied in the 14th and 15th amendments. But while Stevens in many ways pushed his party—and America—towards equality, he also championed ideas too radical for his fellow Congressmen ever to support, such as confiscating large slaveholders’ estates and dividing the land among those who had been enslaved. In Thaddeus Stevens, acclaimed historian Bruce Levine has written a “vital” (The Guardian), “compelling” (James McPherson) biography of one of the most visionary statesmen of the 19th century and a forgotten champion for racial justice in America.",['Bruce Levine'],Simon and Schuster,['Biography & Autobiography']
God is My Co-Pilot,5.0,Great service,Received product as was described by seller in time described by seller.Would buy from this seller again.,,['Robert Lee Scott (Jr.)'],,['Fighter pilots']
Mysteries of John,5.0,I love it,"I am on my way to read the book, it not weighed and look nice, I do love it. it exactelly what I was looking for",,,,
Death of a Stranger (William Monk Series),5.0,The seamier side of life,"This novel is set in London, England, in the early 1860s. The Civil War is being fought in the United States while life goes on as usual in England. The situation described in the novel was usual for that time period, and is similar to the real circumstances that prevailed in my hometown, at that time a notorious sailing port in the U.S., during the later 19th century - a reformer trying to clean up the town soon discovered that most of the &quot;good citizens&quot; were getting their share of the pie, the prostitutes paid in cash and were a mainstay of the town's economy (see &quot;Port Townsend - An Illustrated History of Shanghaiing, Shipwrecks, Soiled Doves, and Sundry Souls&quot;).Hester Monk (who had been a nurse in the Crimea) operates an infirmary in a lower class neighborhood, offering medical services to the ladies of the evening who are suffering from injuries and diseases. Her husband, William Monk, is involved in an investigation of possible financial wrongdoing among the principals of a railroad company. The death of a &quot;respectable&quot; man outside a bordello in the area creates a turmoil and eventually events are drawn together.Circumstances reveal a brutal form of loan sharking. William's investigation brings out information about his past - he was not always a nice person. Past relationships are revealed as the case draws to a conclusion. Overall, an interesting plot, with a good picture of the underside of Victorian London.","The tragic death of a railway magnate in a sleazy brothel has shocked high society. Meanwhile, private investigator William Monk acquires a mysterious new client who asks him to ascertain beyond the shadow of a doubt whether or not her fiancé, a railway-firm executive, has become enmeshed in fraudulent practices. And so Monk embarks upon a journey that will revive memories stripped from his consciousness by amnesia—as a past almost impossible to bear returns, eerily paralleling a fresh tragedy that has already begun its inexorable unfolding.",['Anne Perry'],William Monk,['Fiction']
Beyond Justice: The Auschwitz Trial,5.0,There could be no adequate Justice,Excellent portrayal of all of the reasons that in fact the trial could not deal with a true sense of justice.The crimes were so heinnous that the penal code was inadequate to address them.The prosection's hands were tied and a mere 6500 were charged. It was too little too late.S.J.Tagliareni author of Hitler's Priest,"In 1963, West Germany was gripped by a dramatic trial of former guards who had worked at the Nazi death camp Auschwitz. It was the largest and most public trial to take place in the country and attracted international attention. Using the pretrial files and extensive trial audiotapes, Rebecca Wittmann offers a fascinating reinterpretation of Germany's first major attempt to confront its past. Evoking the courtroom atmosphere, Wittmann vividly recounts the testimony of survivors, former SS officers, and defendants--a cross-section of the camp population. Attorney General Fritz Bauer made an extraordinary effort to put the entire Auschwitz complex on trial, but constrained by West German murder laws, the prosecution had to resort to standards for illegal behavior that echoed the laws of the Third Reich. This provided a legitimacy to the Nazi state. Only those who exceeded direct orders were convicted of murder. This shocking ruling was reflected in the press coverage, which focused on only the most sadistic and brutal crimes, allowing the real atrocity at Auschwitz--mass murder in the gas chambers--to be relegated to the background. The Auschwitz trial had a paradoxical result. Although the prosecution succeeded in exposing SS crimes at the camp for the first time, the public absorbed a distorted representation of the criminality of the camp system. The Auschwitz trial ensured that rather than coming to terms with their Nazi past, Germans managed to delay a true reckoning with the horror of the Holocaust.",['Rebecca Wittmann'],Harvard University Press,['History']
Summer Light,3.0,Summer Light,"I think the book was quite good, however, being a hockey fan I picked up on something. On p53 Luanne says Game 3 also went into overtime, and this time the Oilers won it 2-0. I have discussed this with many people and I don't think it is possible to win a game 2-0 in overtime. The win would be 1-0. I do get upset when authors don't research or have professionals check their work. I can't find an e-mail anywhere for Ms Rice so I am stating my comments here.","When it comes to love and family, the things you can’t see are what matter most of all. Bestselling novelist Luanne Rice has inspired the devotion of readers everywhere with her “rare combination of realism and romance.”(The New York Times Book Review) Now she presents her most magical novel to date, an entrancing story of love at first sight, the true meaning of family, and angels right here on earth. May Taylor works as a wedding planner, passing on the timeless traditions of her grandmother and mother. The Taylor women have always believed in the presence of magic in everyday life--especially the simple magic of true love and family. Yet May’s own faith in true love was shattered when she was abandoned by the father of her child. Still, she finds joy in raising her daughter Kylie, a very special five-year-old who sees and hears things that others cannot. . . Martin Cartier is a professional hockey player and sports legend. His father, a champion, taught him to play to win--at all costs. Now Martin’s success veils a core of heartache, rage, and isolation. Yet Kylie glimpses the transcendent role Martin will play in May’s life and her own--unless his past tears their blossoming love apart. Then only Kylie will see the way home--and only May will be able to lead them there, if she can believe in magic once more.",['Luanne Rice'],Bantam,['Fiction']
Matter and Interactions I: Modern Mechanics,5.0,amazing!,"I had the privilege of learning freshmen physics from the authors. The authors and their book present a new way of learning physics. Although the exercises are nontraditional, I find them to be more insightful than simple &quot;plug and chug&quot; problems.",,"['Ruth W. Chabay', 'Bruce A. Sherwood']",John Wiley & Sons,['Science']
